[
  {
    "segment_id": "seg_q1",
    "trial_id": "T98",
    "question_id": "Q_FIXTURE_02",
    "panel_label": "question",
    "corrected_text": "Describe cellular respiration stages.",
    "segment_type": "sentence",
    "segment_role": "question_stem",
    "level_band": null,
    "mark_point_id": null,
    "star_id": null,
    "bools": {
      "command_word": false,
      "domain_term": false,
      "is_bullet_point": false,
      "is_level_descriptor": false,
      "is_mark_scheme_point": false,
      "is_commentary": false,
      "is_star_chart": false,
      "requires_calculation": false,
      "contains_data_reference": false,
      "contains_allow_instruction": false,
      "contains_reject_instruction": false,
      "contains_comparison": false
    },
    "formatting": {
      "bold": false,
      "italic": false,
      "formatted_prop": 0.0
    },
    "geometry": {
      "x": 40,
      "y": 40,
      "w": 400,
      "h": 40,
      "n_boxes": 1,
      "n_lines": 1
    },
    "segment_order": 0
  },
  {
    "segment_id": "seg_r1",
    "trial_id": "T98",
    "question_id": "Q_FIXTURE_02",
    "panel_label": "response",
    "corrected_text": "Glycolysis breaks down glucose in the cytoplasm.",
    "segment_type": "sentence",
    "segment_role": "response_text",
    "level_band": null,
    "mark_point_id": null,
    "star_id": null,
    "bools": {
      "command_word": false,
      "domain_term": false,
      "is_bullet_point": false,
      "is_level_descriptor": false,
      "is_mark_scheme_point": false,
      "is_commentary": false,
      "is_star_chart": false,
      "requires_calculation": false,
      "contains_data_reference": false,
      "contains_allow_instruction": false,
      "contains_reject_instruction": false,
      "contains_comparison": false
    },
    "formatting": {
      "bold": false,
      "italic": false,
      "formatted_prop": 0.0
    },
    "geometry": {
      "x": 40,
      "y": 200,
      "w": 420,
      "h": 50,
      "n_boxes": 1,
      "n_lines": 1
    },
    "segment_order": 0
  },
  {
    "segment_id": "seg_r2",
    "trial_id": "T98",
    "question_id": "Q_FIXTURE_02",
    "panel_label": "response",
    "corrected_text": "The Krebs cycle releases carbon dioxide.",
    "segment_type": "sentence",
    "segment_role": "response_text",
    "level_band": null,
    "mark_point_id": null,
    "star_id": null,
    "bools": {
      "command_word": false,
      "domain_term": false,
      "is_bullet_point": false,
      "is_level_descriptor": false,
      "is_mark_scheme_point": false,
      "is_commentary": false,
      "is_star_chart": false,
      "requires_calculation": false,
      "contains_data_reference": false,
      "contains_allow_instruction": false,
      "contains_reject_instruction": false,
      "contains_comparison": false
    },
    "formatting": {
      "bold": false,
      "italic": false,
      "formatted_prop": 0.0
    },
    "geometry": {
      "x": 40,
      "y": 260,
      "w": 420,
      "h": 50,
      "n_boxes": 1,
      "n_lines": 1
    },
    "segment_order": 1
  },
  {
    "segment_id": "seg_ms1",
    "trial_id": "T98",
    "question_id": "Q_FIXTURE_02",
    "panel_label": "mark_scheme",
    "corrected_text": "Glycolysis occurs in the cytoplasm.",
    "segment_type": "mark_scheme_point",
    "segment_role": "answers",
    "level_band": null,
    "mark_point_id": "mp_01",
    "star_id": null,
    "bools": {
      "command_word": false,
      "domain_term": false,
      "is_bullet_point": true,
      "is_level_descriptor": false,
      "is_mark_scheme_point": true,
      "is_commentary": false,
      "is_star_chart": false,
      "requires_calculation": false,
      "contains_data_reference": false,
      "contains_allow_instruction": false,
      "contains_reject_instruction": false,
      "contains_comparison": false
    },
    "formatting": {
      "bold": false,
      "italic": false,
      "formatted_prop": 0.0
    },
    "geometry": {
      "x": 500,
      "y": 200,
      "w": 380,
      "h": 40,
      "n_boxes": 1,
      "n_lines": 1
    },
    "segment_order": 0
  },
  {
    "segment_id": "seg_ms2",
    "trial_id": "T98",
    "question_id": "Q_FIXTURE_02",
    "panel_label": "mark_scheme",
    "corrected_text": "Krebs cycle produces CO2.",
    "segment_type": "mark_scheme_point",
    "segment_role": "answers",
    "level_band": null,
    "mark_point_id": "mp_02",
    "star_id": null,
    "bools": {
      "command_word": false,
      "domain_term": false,
      "is_bullet_point": true,
      "is_level_descriptor": false,
      "is_mark_scheme_point": true,
      "is_commentary": false,
      "is_star_chart": false,
      "requires_calculation": false,
      "contains_data_reference": false,
      "contains_allow_instruction": false,
      "contains_reject_instruction": false,
      "contains_comparison": false
    },
    "formatting": {
      "bold": false,
      "italic": false,
      "formatted_prop": 0.0
    },
    "geometry": {
      "x": 500,
      "y": 250,
      "w": 380,
      "h": 40,
      "n_boxes": 1,
      "n_lines": 1
    },
    "segment_order": 1
  },
  {
    "segment_id": "seg_c1",
    "trial_id": "T98",
    "question_id": "Q_FIXTURE_02",
    "panel_label": "commentary",
    "corrected_text": "Credit correct organelle references.",
    "segment_type": "commentary_guidance",
    "segment_role": "commentary",
    "level_band": null,
    "mark_point_id": null,
    "star_id": null,
    "bools": {
      "command_word": false,
      "domain_term": false,
      "is_bullet_point": false,
      "is_level_descriptor": false,
      "is_mark_scheme_point": false,
      "is_commentary": true,
      "is_star_chart": false,
      "requires_calculation": false,
      "contains_data_reference": false,
      "contains_allow_instruction": false,
      "contains_reject_instruction": false,
      "contains_comparison": false
    },
    "formatting": {
      "bold": false,
      "italic": false,
      "formatted_prop": 0.0
    },
    "geometry": {
      "x": 40,
      "y": 450,
      "w": 840,
      "h": 40,
      "n_boxes": 1,
      "n_lines": 1
    },
    "segment_order": 0
  },
  {
    "segment_id": "seg_st1",
    "trial_id": "T98",
    "question_id": "Q_FIXTURE_02",
    "panel_label": "star_chart",
    "corrected_text": "Energy transfer",
    "segment_type": "star_concept",
    "segment_role": "star_concept",
    "level_band": null,
    "mark_point_id": null,
    "star_id": "star_01",
    "bools": {
      "command_word": false,
      "domain_term": false,
      "is_bullet_point": false,
      "is_level_descriptor": false,
      "is_mark_scheme_point": false,
      "is_commentary": false,
      "is_star_chart": true,
      "requires_calculation": false,
      "contains_data_reference": false,
      "contains_allow_instruction": false,
      "contains_reject_instruction": false,
      "contains_comparison": false
    },
    "formatting": {
      "bold": false,
      "italic": false,
      "formatted_prop": 0.0
    },
    "geometry": {
      "x": 900,
      "y": 200,
      "w": 160,
      "h": 40,
      "n_boxes": 1,
      "n_lines": 1
    },
    "segment_order": 0
  },
  {
    "segment_id": "seg_st2",
    "trial_id": "T98",
    "question_id": "Q_FIXTURE_02",
    "panel_label": "star_chart",
    "corrected_text": "Gas exchange",
    "segment_type": "star_concept",
    "segment_role": "star_concept",
    "level_band": null,
    "mark_point_id": null,
    "star_id": "star_02",
    "bools": {
      "command_word": false,
      "domain_term": false,
      "is_bullet_point": false,
      "is_level_descriptor": false,
      "is_mark_scheme_point": false,
      "is_commentary": false,
      "is_star_chart": true,
      "requires_calculation": false,
      "contains_data_reference": false,
      "contains_allow_instruction": false,
      "contains_reject_instruction": false,
      "contains_comparison": false
    },
    "formatting": {
      "bold": false,
      "italic": false,
      "formatted_prop": 0.0
    },
    "geometry": {
      "x": 900,
      "y": 250,
      "w": 160,
      "h": 40,
      "n_boxes": 1,
      "n_lines": 1
    },
    "segment_order": 1
  },
  {
    "segment_id": "seg_q2",
    "trial_id": "T98",
    "question_id": "Q_FIXTURE_02",
    "panel_label": "question",
    "corrected_text": "Link each stage to its products.",
    "segment_type": "sentence",
    "segment_role": "question_stem",
    "level_band": null,
    "mark_point_id": null,
    "star_id": null,
    "bools": {
      "command_word": false,
      "domain_term": false,
      "is_bullet_point": false,
      "is_level_descriptor": false,
      "is_mark_scheme_point": false,
      "is_commentary": false,
      "is_star_chart": false,
      "requires_calculation": false,
      "contains_data_reference": false,
      "contains_allow_instruction": false,
      "contains_reject_instruction": false,
      "contains_comparison": false
    },
    "formatting": {
      "bold": false,
      "italic": false,
      "formatted_prop": 0.0
    },
    "geometry": {
      "x": 40,
      "y": 90,
      "w": 400,
      "h": 40,
      "n_boxes": 1,
      "n_lines": 1
    },
    "segment_order": 1
  },
  {
    "segment_id": "seg_ld1",
    "trial_id": "T98",
    "question_id": "Q_FIXTURE_02",
    "panel_label": "mark_scheme",
    "corrected_text": "Level 3: stages linked to products accurately.",
    "segment_type": "level_descriptor",
    "segment_role": "level_descriptor",
    "level_band": "L3",
    "mark_point_id": null,
    "star_id": null,
    "bools": {
      "command_word": false,
      "domain_term": false,
      "is_bullet_point": false,
      "is_level_descriptor": true,
      "is_mark_scheme_point": false,
      "is_commentary": false,
      "is_star_chart": false,
      "requires_calculation": false,
      "contains_data_reference": false,
      "contains_allow_instruction": false,
      "contains_reject_instruction": false,
      "contains_comparison": false
    },
    "formatting": {